{
  "bundle_id": "com.anthropic.claudefordesktop",
  "agent_class": "third_party",
  "is_daemon": false,
  "is_apple_signed": false,
  "suppress_user_authorization_prompt": false,
  "system_bundle": false,
  "interrupt_level": "standard",
  "enriched_at": "2026-07-31T05:00:00Z",
  "enrichment_source": "synapseiq.agent-classifier",
  "confidence": 0.98,
  "classification_method": "bundle_id_lookup"
}
